{
  "generated": "2025-10-27T01:51:32.538350+00:00",
  "policy_fingerprint": "0xbe3a798944b1c64b",
  "source_evidence": "entries/immune/bromelain-infl-inf06/inflammation/v1/evidence.csv",
  "preferred_citation": "Kim G. TERVYX Protocol v1.0 (2025).",
  "studies": [
    {
      "study_id": "INFL-INF06-01",
      "year": 2013,
      "design": "randomized controlled trial",
      "journal": "inflammation-journal-01",
      "outcome": "joint_pain",
      "population": "Adults with joint pain concerns",
      "adverse_events": "Mild GI discomfort",
      "doi": "10.1234/infl-inf06-01",
      "url": "https://doi.org/10.1234/infl-inf06-01",
      "citation": "INFL-INF06-01 (2013); Journal: inflammation-journal-01; Design: randomized controlled trial; Population: Adults with joint pain concerns; Outcome: joint_pain; DOI: 10.1234/infl-inf06-01; Adverse Events: Mild GI discomfort."
    },
    {
      "study_id": "INFL-INF06-02",
      "year": 2018,
      "design": "randomized controlled trial",
      "journal": "inflammation-journal-02",
      "outcome": "joint_pain",
      "population": "Adults with joint pain concerns",
      "adverse_events": "None reported",
      "doi": "10.1234/infl-inf06-02",
      "url": "https://doi.org/10.1234/infl-inf06-02",
      "citation": "INFL-INF06-02 (2018); Journal: inflammation-journal-02; Design: randomized controlled trial; Population: Adults with joint pain concerns; Outcome: joint_pain; DOI: 10.1234/infl-inf06-02; Adverse Events: None reported."
    },
    {
      "study_id": "INFL-INF06-03",
      "year": 2023,
      "design": "randomized controlled trial",
      "journal": "inflammation-journal-03",
      "outcome": "joint_pain",
      "population": "Adults with joint pain concerns",
      "adverse_events": "Transient headache",
      "doi": "10.1234/infl-inf06-03",
      "url": "https://doi.org/10.1234/infl-inf06-03",
      "citation": "INFL-INF06-03 (2023); Journal: inflammation-journal-03; Design: randomized controlled trial; Population: Adults with joint pain concerns; Outcome: joint_pain; DOI: 10.1234/infl-inf06-03; Adverse Events: Transient headache."
    }
  ],
  "references": [
    {
      "type": "doi",
      "identifier": "10.1234/infl-inf06-01",
      "study_ids": [
        "INFL-INF06-01"
      ],
      "primary_study_id": "INFL-INF06-01",
      "url": "https://doi.org/10.1234/infl-inf06-01"
    },
    {
      "type": "doi",
      "identifier": "10.1234/infl-inf06-02",
      "study_ids": [
        "INFL-INF06-02"
      ],
      "primary_study_id": "INFL-INF06-02",
      "url": "https://doi.org/10.1234/infl-inf06-02"
    },
    {
      "type": "doi",
      "identifier": "10.1234/infl-inf06-03",
      "study_ids": [
        "INFL-INF06-03"
      ],
      "primary_study_id": "INFL-INF06-03",
      "url": "https://doi.org/10.1234/infl-inf06-03"
    }
  ],
  "manifest_hash": "sha256:45bea65746f89ecde9ad3496cd5ace929f956b2789c308c01173fa3892d1ce45"
}
