{
  "generated": "2025-11-06T07:07:39.522306+00:00",
  "policy_fingerprint": "0x6036438e1b958d88",
  "source_evidence": "entries/neurological/caffeine-l-theanine-cogn-gen-0118/cognition/v1/evidence.csv",
  "preferred_citation": "Kim G. TERVYX Protocol v1.0 (2025).",
  "studies": [
    {
      "study_id": "COGN-GEN-0118_01",
      "year": 2012,
      "design": "randomized controlled trial",
      "journal": "cognition_journal",
      "outcome": "attention",
      "population": "Adults with attention concerns",
      "adverse_events": "Mild GI discomfort",
      "doi": "10.1234/caffeine-l-theanine-cogn-gen-0118-01",
      "url": "https://doi.org/10.1234/caffeine-l-theanine-cogn-gen-0118-01",
      "citation": "COGN-GEN-0118_01 (2012); Journal: cognition_journal; Design: randomized controlled trial; Population: Adults with attention concerns; Outcome: attention; DOI: 10.1234/caffeine-l-theanine-cogn-gen-0118-01; Adverse Events: Mild GI discomfort."
    },
    {
      "study_id": "COGN-GEN-0118_02",
      "year": 2013,
      "design": "randomized controlled trial",
      "journal": "cognition_journal",
      "outcome": "attention",
      "population": "Adults with attention concerns",
      "adverse_events": "Mild GI discomfort",
      "doi": "10.1234/caffeine-l-theanine-cogn-gen-0118-02",
      "url": "https://doi.org/10.1234/caffeine-l-theanine-cogn-gen-0118-02",
      "citation": "COGN-GEN-0118_02 (2013); Journal: cognition_journal; Design: randomized controlled trial; Population: Adults with attention concerns; Outcome: attention; DOI: 10.1234/caffeine-l-theanine-cogn-gen-0118-02; Adverse Events: Mild GI discomfort."
    },
    {
      "study_id": "COGN-GEN-0118_03",
      "year": 2014,
      "design": "randomized controlled trial",
      "journal": "cognition_journal",
      "outcome": "attention",
      "population": "Adults with attention concerns",
      "adverse_events": "None reported",
      "doi": "10.1234/caffeine-l-theanine-cogn-gen-0118-03",
      "url": "https://doi.org/10.1234/caffeine-l-theanine-cogn-gen-0118-03",
      "citation": "COGN-GEN-0118_03 (2014); Journal: cognition_journal; Design: randomized controlled trial; Population: Adults with attention concerns; Outcome: attention; DOI: 10.1234/caffeine-l-theanine-cogn-gen-0118-03; Adverse Events: None reported."
    }
  ],
  "references": [
    {
      "type": "doi",
      "identifier": "10.1234/caffeine-l-theanine-cogn-gen-0118-01",
      "study_ids": [
        "COGN-GEN-0118_01"
      ],
      "primary_study_id": "COGN-GEN-0118_01",
      "url": "https://doi.org/10.1234/caffeine-l-theanine-cogn-gen-0118-01"
    },
    {
      "type": "doi",
      "identifier": "10.1234/caffeine-l-theanine-cogn-gen-0118-02",
      "study_ids": [
        "COGN-GEN-0118_02"
      ],
      "primary_study_id": "COGN-GEN-0118_02",
      "url": "https://doi.org/10.1234/caffeine-l-theanine-cogn-gen-0118-02"
    },
    {
      "type": "doi",
      "identifier": "10.1234/caffeine-l-theanine-cogn-gen-0118-03",
      "study_ids": [
        "COGN-GEN-0118_03"
      ],
      "primary_study_id": "COGN-GEN-0118_03",
      "url": "https://doi.org/10.1234/caffeine-l-theanine-cogn-gen-0118-03"
    }
  ],
  "manifest_hash": "sha256:e8f9d4a2c259b4a82492c81227dfa25ab61b033ede684e48ac19483d4dde6ae2"
}
