{
  "generated": "2025-11-06T07:07:44.217077+00:00",
  "policy_fingerprint": "0x6036438e1b958d88",
  "source_evidence": "entries/behavioral/lemon-balm-slee-gen-0090/sleep/v1/evidence.csv",
  "preferred_citation": "Kim G. TERVYX Protocol v1.0 (2025).",
  "studies": [
    {
      "study_id": "SLEE-GEN-0090_01",
      "year": 2016,
      "design": "randomized controlled trial",
      "journal": "sleep_journal",
      "outcome": "sleep_onset",
      "population": "Adults with sleep onset concerns",
      "adverse_events": "Mild GI discomfort",
      "doi": "10.1234/lemon-balm-slee-gen-0090-01",
      "url": "https://doi.org/10.1234/lemon-balm-slee-gen-0090-01",
      "citation": "SLEE-GEN-0090_01 (2016); Journal: sleep_journal; Design: randomized controlled trial; Population: Adults with sleep onset concerns; Outcome: sleep_onset; DOI: 10.1234/lemon-balm-slee-gen-0090-01; Adverse Events: Mild GI discomfort."
    },
    {
      "study_id": "SLEE-GEN-0090_02",
      "year": 2017,
      "design": "randomized controlled trial",
      "journal": "sleep_journal",
      "outcome": "sleep_onset",
      "population": "Adults with sleep onset concerns",
      "adverse_events": "None reported",
      "doi": "10.1234/lemon-balm-slee-gen-0090-02",
      "url": "https://doi.org/10.1234/lemon-balm-slee-gen-0090-02",
      "citation": "SLEE-GEN-0090_02 (2017); Journal: sleep_journal; Design: randomized controlled trial; Population: Adults with sleep onset concerns; Outcome: sleep_onset; DOI: 10.1234/lemon-balm-slee-gen-0090-02; Adverse Events: None reported."
    },
    {
      "study_id": "SLEE-GEN-0090_03",
      "year": 2018,
      "design": "randomized controlled trial",
      "journal": "sleep_journal",
      "outcome": "sleep_onset",
      "population": "Adults with sleep onset concerns",
      "adverse_events": "Transient headache",
      "doi": "10.1234/lemon-balm-slee-gen-0090-03",
      "url": "https://doi.org/10.1234/lemon-balm-slee-gen-0090-03",
      "citation": "SLEE-GEN-0090_03 (2018); Journal: sleep_journal; Design: randomized controlled trial; Population: Adults with sleep onset concerns; Outcome: sleep_onset; DOI: 10.1234/lemon-balm-slee-gen-0090-03; Adverse Events: Transient headache."
    }
  ],
  "references": [
    {
      "type": "doi",
      "identifier": "10.1234/lemon-balm-slee-gen-0090-01",
      "study_ids": [
        "SLEE-GEN-0090_01"
      ],
      "primary_study_id": "SLEE-GEN-0090_01",
      "url": "https://doi.org/10.1234/lemon-balm-slee-gen-0090-01"
    },
    {
      "type": "doi",
      "identifier": "10.1234/lemon-balm-slee-gen-0090-02",
      "study_ids": [
        "SLEE-GEN-0090_02"
      ],
      "primary_study_id": "SLEE-GEN-0090_02",
      "url": "https://doi.org/10.1234/lemon-balm-slee-gen-0090-02"
    },
    {
      "type": "doi",
      "identifier": "10.1234/lemon-balm-slee-gen-0090-03",
      "study_ids": [
        "SLEE-GEN-0090_03"
      ],
      "primary_study_id": "SLEE-GEN-0090_03",
      "url": "https://doi.org/10.1234/lemon-balm-slee-gen-0090-03"
    }
  ],
  "manifest_hash": "sha256:bf04bf458cf0b7c427673e9d383871dbe115e02946a5b252d19af914543bbb09"
}
