{
  "generated": "2025-10-27T01:51:32.588664+00:00",
  "policy_fingerprint": "0xbe3a798944b1c64b",
  "source_evidence": "entries/physiological/creatine-musc-msk11/musculoskeletal/v1/evidence.csv",
  "preferred_citation": "Kim G. TERVYX Protocol v1.0 (2025).",
  "studies": [
    {
      "study_id": "MUSC-MSK11-01",
      "year": 2012,
      "design": "randomized controlled trial",
      "journal": "musculoskeletal-journal-01",
      "outcome": "muscle_recovery",
      "population": "Adults with muscle recovery concerns",
      "adverse_events": "Transient headache",
      "doi": "10.1234/musc-msk11-01",
      "url": "https://doi.org/10.1234/musc-msk11-01",
      "citation": "MUSC-MSK11-01 (2012); Journal: musculoskeletal-journal-01; Design: randomized controlled trial; Population: Adults with muscle recovery concerns; Outcome: muscle_recovery; DOI: 10.1234/musc-msk11-01; Adverse Events: Transient headache."
    },
    {
      "study_id": "MUSC-MSK11-02",
      "year": 2017,
      "design": "randomized controlled trial",
      "journal": "musculoskeletal-journal-02",
      "outcome": "muscle_recovery",
      "population": "Adults with muscle recovery concerns",
      "adverse_events": "Mild GI discomfort",
      "doi": "10.1234/musc-msk11-02",
      "url": "https://doi.org/10.1234/musc-msk11-02",
      "citation": "MUSC-MSK11-02 (2017); Journal: musculoskeletal-journal-02; Design: randomized controlled trial; Population: Adults with muscle recovery concerns; Outcome: muscle_recovery; DOI: 10.1234/musc-msk11-02; Adverse Events: Mild GI discomfort."
    },
    {
      "study_id": "MUSC-MSK11-03",
      "year": 2022,
      "design": "randomized controlled trial",
      "journal": "musculoskeletal-journal-03",
      "outcome": "muscle_recovery",
      "population": "Adults with muscle recovery concerns",
      "adverse_events": "None reported",
      "doi": "10.1234/musc-msk11-03",
      "url": "https://doi.org/10.1234/musc-msk11-03",
      "citation": "MUSC-MSK11-03 (2022); Journal: musculoskeletal-journal-03; Design: randomized controlled trial; Population: Adults with muscle recovery concerns; Outcome: muscle_recovery; DOI: 10.1234/musc-msk11-03; Adverse Events: None reported."
    }
  ],
  "references": [
    {
      "type": "doi",
      "identifier": "10.1234/musc-msk11-01",
      "study_ids": [
        "MUSC-MSK11-01"
      ],
      "primary_study_id": "MUSC-MSK11-01",
      "url": "https://doi.org/10.1234/musc-msk11-01"
    },
    {
      "type": "doi",
      "identifier": "10.1234/musc-msk11-02",
      "study_ids": [
        "MUSC-MSK11-02"
      ],
      "primary_study_id": "MUSC-MSK11-02",
      "url": "https://doi.org/10.1234/musc-msk11-02"
    },
    {
      "type": "doi",
      "identifier": "10.1234/musc-msk11-03",
      "study_ids": [
        "MUSC-MSK11-03"
      ],
      "primary_study_id": "MUSC-MSK11-03",
      "url": "https://doi.org/10.1234/musc-msk11-03"
    }
  ],
  "manifest_hash": "sha256:139feb65bf6e9b40e5983104e037e9e1dfa2a1701c13fe052c2256572a2589e2"
}
