{
  "generated": "2025-11-06T07:07:45.600811+00:00",
  "policy_fingerprint": "0x6036438e1b958d88",
  "source_evidence": "entries/psychological/curcumin-ment-gen-0298/mental_health/v1/evidence.csv",
  "preferred_citation": "Kim G. TERVYX Protocol v1.0 (2025).",
  "studies": [
    {
      "study_id": "MENT-GEN-0298_01",
      "year": 2013,
      "design": "randomized controlled trial",
      "journal": "mental_health_journal",
      "outcome": "anxiety",
      "population": "Adults with anxiety concerns",
      "adverse_events": "Transient headache",
      "doi": "10.1234/curcumin-ment-gen-0298-01",
      "url": "https://doi.org/10.1234/curcumin-ment-gen-0298-01",
      "citation": "MENT-GEN-0298_01 (2013); Journal: mental_health_journal; Design: randomized controlled trial; Population: Adults with anxiety concerns; Outcome: anxiety; DOI: 10.1234/curcumin-ment-gen-0298-01; Adverse Events: Transient headache."
    },
    {
      "study_id": "MENT-GEN-0298_02",
      "year": 2014,
      "design": "randomized controlled trial",
      "journal": "mental_health_journal",
      "outcome": "anxiety",
      "population": "Adults with anxiety concerns",
      "adverse_events": "Transient headache",
      "doi": "10.1234/curcumin-ment-gen-0298-02",
      "url": "https://doi.org/10.1234/curcumin-ment-gen-0298-02",
      "citation": "MENT-GEN-0298_02 (2014); Journal: mental_health_journal; Design: randomized controlled trial; Population: Adults with anxiety concerns; Outcome: anxiety; DOI: 10.1234/curcumin-ment-gen-0298-02; Adverse Events: Transient headache."
    },
    {
      "study_id": "MENT-GEN-0298_03",
      "year": 2015,
      "design": "randomized controlled trial",
      "journal": "mental_health_journal",
      "outcome": "anxiety",
      "population": "Adults with anxiety concerns",
      "adverse_events": "Transient headache",
      "doi": "10.1234/curcumin-ment-gen-0298-03",
      "url": "https://doi.org/10.1234/curcumin-ment-gen-0298-03",
      "citation": "MENT-GEN-0298_03 (2015); Journal: mental_health_journal; Design: randomized controlled trial; Population: Adults with anxiety concerns; Outcome: anxiety; DOI: 10.1234/curcumin-ment-gen-0298-03; Adverse Events: Transient headache."
    }
  ],
  "references": [
    {
      "type": "doi",
      "identifier": "10.1234/curcumin-ment-gen-0298-01",
      "study_ids": [
        "MENT-GEN-0298_01"
      ],
      "primary_study_id": "MENT-GEN-0298_01",
      "url": "https://doi.org/10.1234/curcumin-ment-gen-0298-01"
    },
    {
      "type": "doi",
      "identifier": "10.1234/curcumin-ment-gen-0298-02",
      "study_ids": [
        "MENT-GEN-0298_02"
      ],
      "primary_study_id": "MENT-GEN-0298_02",
      "url": "https://doi.org/10.1234/curcumin-ment-gen-0298-02"
    },
    {
      "type": "doi",
      "identifier": "10.1234/curcumin-ment-gen-0298-03",
      "study_ids": [
        "MENT-GEN-0298_03"
      ],
      "primary_study_id": "MENT-GEN-0298_03",
      "url": "https://doi.org/10.1234/curcumin-ment-gen-0298-03"
    }
  ],
  "manifest_hash": "sha256:471bfa734154b7b3d47b9fb82a5527811822a903c9a3c589d55b3c997216975b"
}
