{
  "generated": "2025-11-06T07:17:32.377450+00:00",
  "policy_fingerprint": "0x6036438e1b958d88",
  "source_evidence": "entries/immune/green-tea-infl-gen-0547/inflammation/v1/evidence.csv",
  "preferred_citation": "Kim G. TERVYX Protocol v1.0 (2025).",
  "studies": [
    {
      "study_id": "INFL-GEN-0547_01",
      "year": 2016,
      "design": "randomized controlled trial",
      "journal": "inflammation_journal",
      "outcome": "chronic_inflammation",
      "population": "Adults with chronic inflammation concerns",
      "adverse_events": "Transient headache",
      "doi": "10.1234/green-tea-infl-gen-0547-01",
      "url": "https://doi.org/10.1234/green-tea-infl-gen-0547-01",
      "citation": "INFL-GEN-0547_01 (2016); Journal: inflammation_journal; Design: randomized controlled trial; Population: Adults with chronic inflammation concerns; Outcome: chronic_inflammation; DOI: 10.1234/green-tea-infl-gen-0547-01; Adverse Events: Transient headache."
    },
    {
      "study_id": "INFL-GEN-0547_02",
      "year": 2017,
      "design": "randomized controlled trial",
      "journal": "inflammation_journal",
      "outcome": "chronic_inflammation",
      "population": "Adults with chronic inflammation concerns",
      "adverse_events": "Mild GI discomfort",
      "doi": "10.1234/green-tea-infl-gen-0547-02",
      "url": "https://doi.org/10.1234/green-tea-infl-gen-0547-02",
      "citation": "INFL-GEN-0547_02 (2017); Journal: inflammation_journal; Design: randomized controlled trial; Population: Adults with chronic inflammation concerns; Outcome: chronic_inflammation; DOI: 10.1234/green-tea-infl-gen-0547-02; Adverse Events: Mild GI discomfort."
    },
    {
      "study_id": "INFL-GEN-0547_03",
      "year": 2018,
      "design": "randomized controlled trial",
      "journal": "inflammation_journal",
      "outcome": "chronic_inflammation",
      "population": "Adults with chronic inflammation concerns",
      "adverse_events": "None reported",
      "doi": "10.1234/green-tea-infl-gen-0547-03",
      "url": "https://doi.org/10.1234/green-tea-infl-gen-0547-03",
      "citation": "INFL-GEN-0547_03 (2018); Journal: inflammation_journal; Design: randomized controlled trial; Population: Adults with chronic inflammation concerns; Outcome: chronic_inflammation; DOI: 10.1234/green-tea-infl-gen-0547-03; Adverse Events: None reported."
    }
  ],
  "references": [
    {
      "type": "doi",
      "identifier": "10.1234/green-tea-infl-gen-0547-01",
      "study_ids": [
        "INFL-GEN-0547_01"
      ],
      "primary_study_id": "INFL-GEN-0547_01",
      "url": "https://doi.org/10.1234/green-tea-infl-gen-0547-01"
    },
    {
      "type": "doi",
      "identifier": "10.1234/green-tea-infl-gen-0547-02",
      "study_ids": [
        "INFL-GEN-0547_02"
      ],
      "primary_study_id": "INFL-GEN-0547_02",
      "url": "https://doi.org/10.1234/green-tea-infl-gen-0547-02"
    },
    {
      "type": "doi",
      "identifier": "10.1234/green-tea-infl-gen-0547-03",
      "study_ids": [
        "INFL-GEN-0547_03"
      ],
      "primary_study_id": "INFL-GEN-0547_03",
      "url": "https://doi.org/10.1234/green-tea-infl-gen-0547-03"
    }
  ],
  "manifest_hash": "sha256:669a981a7b6e04e5e5b4e5049f4dc512d0c50f5a6b0d7ff7306cf4273c162b8c"
}
