{
  "generated": "2025-11-06T07:07:41.403374+00:00",
  "policy_fingerprint": "0x6036438e1b958d88",
  "source_evidence": "entries/behavioral/kava-slee-gen-0054/sleep/v1/evidence.csv",
  "preferred_citation": "Kim G. TERVYX Protocol v1.0 (2025).",
  "studies": [
    {
      "study_id": "SLEE-GEN-0054_01",
      "year": 2016,
      "design": "randomized controlled trial",
      "journal": "sleep_journal",
      "outcome": "sleep_anxiety",
      "population": "Adults with sleep anxiety concerns",
      "adverse_events": "Mild GI discomfort",
      "doi": "10.1234/kava-slee-gen-0054-01",
      "url": "https://doi.org/10.1234/kava-slee-gen-0054-01",
      "citation": "SLEE-GEN-0054_01 (2016); Journal: sleep_journal; Design: randomized controlled trial; Population: Adults with sleep anxiety concerns; Outcome: sleep_anxiety; DOI: 10.1234/kava-slee-gen-0054-01; Adverse Events: Mild GI discomfort."
    },
    {
      "study_id": "SLEE-GEN-0054_02",
      "year": 2017,
      "design": "randomized controlled trial",
      "journal": "sleep_journal",
      "outcome": "sleep_anxiety",
      "population": "Adults with sleep anxiety concerns",
      "adverse_events": "None reported",
      "doi": "10.1234/kava-slee-gen-0054-02",
      "url": "https://doi.org/10.1234/kava-slee-gen-0054-02",
      "citation": "SLEE-GEN-0054_02 (2017); Journal: sleep_journal; Design: randomized controlled trial; Population: Adults with sleep anxiety concerns; Outcome: sleep_anxiety; DOI: 10.1234/kava-slee-gen-0054-02; Adverse Events: None reported."
    },
    {
      "study_id": "SLEE-GEN-0054_03",
      "year": 2018,
      "design": "randomized controlled trial",
      "journal": "sleep_journal",
      "outcome": "sleep_anxiety",
      "population": "Adults with sleep anxiety concerns",
      "adverse_events": "Transient headache",
      "doi": "10.1234/kava-slee-gen-0054-03",
      "url": "https://doi.org/10.1234/kava-slee-gen-0054-03",
      "citation": "SLEE-GEN-0054_03 (2018); Journal: sleep_journal; Design: randomized controlled trial; Population: Adults with sleep anxiety concerns; Outcome: sleep_anxiety; DOI: 10.1234/kava-slee-gen-0054-03; Adverse Events: Transient headache."
    }
  ],
  "references": [
    {
      "type": "doi",
      "identifier": "10.1234/kava-slee-gen-0054-01",
      "study_ids": [
        "SLEE-GEN-0054_01"
      ],
      "primary_study_id": "SLEE-GEN-0054_01",
      "url": "https://doi.org/10.1234/kava-slee-gen-0054-01"
    },
    {
      "type": "doi",
      "identifier": "10.1234/kava-slee-gen-0054-02",
      "study_ids": [
        "SLEE-GEN-0054_02"
      ],
      "primary_study_id": "SLEE-GEN-0054_02",
      "url": "https://doi.org/10.1234/kava-slee-gen-0054-02"
    },
    {
      "type": "doi",
      "identifier": "10.1234/kava-slee-gen-0054-03",
      "study_ids": [
        "SLEE-GEN-0054_03"
      ],
      "primary_study_id": "SLEE-GEN-0054_03",
      "url": "https://doi.org/10.1234/kava-slee-gen-0054-03"
    }
  ],
  "manifest_hash": "sha256:2db28fa9222077d3086515df7b7b3e56ea2179adeabb2d0099c3e5920977be8c"
}
