{
  "generated": "2025-10-24T08:19:11.693091+00:00",
  "policy_fingerprint": "0xbe3a798944b1c64b",
  "source_evidence": "entries/metabolic/berberine-met-gluc-ber/metabolic/v1/evidence.csv",
  "preferred_citation": "Kim G. TERVYX Protocol v1.0 (2025).",
  "studies": [
    {
      "study_id": "MET-GLUC-BER_01",
      "year": 2012,
      "design": "randomized controlled trial",
      "journal": "metabolic_journal",
      "outcome": "glucose_management",
      "population": "Adults with glucose management concerns",
      "adverse_events": "Transient headache",
      "doi": "10.1234/berberine-met-gluc-ber-01",
      "url": "https://doi.org/10.1234/berberine-met-gluc-ber-01",
      "citation": "MET-GLUC-BER_01 (2012); Journal: metabolic_journal; Design: randomized controlled trial; Population: Adults with glucose management concerns; Outcome: glucose_management; DOI: 10.1234/berberine-met-gluc-ber-01; Adverse Events: Transient headache."
    },
    {
      "study_id": "MET-GLUC-BER_02",
      "year": 2013,
      "design": "randomized controlled trial",
      "journal": "metabolic_journal",
      "outcome": "glucose_management",
      "population": "Adults with glucose management concerns",
      "adverse_events": "Mild GI discomfort",
      "doi": "10.1234/berberine-met-gluc-ber-02",
      "url": "https://doi.org/10.1234/berberine-met-gluc-ber-02",
      "citation": "MET-GLUC-BER_02 (2013); Journal: metabolic_journal; Design: randomized controlled trial; Population: Adults with glucose management concerns; Outcome: glucose_management; DOI: 10.1234/berberine-met-gluc-ber-02; Adverse Events: Mild GI discomfort."
    },
    {
      "study_id": "MET-GLUC-BER_03",
      "year": 2014,
      "design": "randomized controlled trial",
      "journal": "metabolic_journal",
      "outcome": "glucose_management",
      "population": "Adults with glucose management concerns",
      "adverse_events": "None reported",
      "doi": "10.1234/berberine-met-gluc-ber-03",
      "url": "https://doi.org/10.1234/berberine-met-gluc-ber-03",
      "citation": "MET-GLUC-BER_03 (2014); Journal: metabolic_journal; Design: randomized controlled trial; Population: Adults with glucose management concerns; Outcome: glucose_management; DOI: 10.1234/berberine-met-gluc-ber-03; Adverse Events: None reported."
    }
  ],
  "references": [
    {
      "type": "doi",
      "identifier": "10.1234/berberine-met-gluc-ber-01",
      "study_ids": [
        "MET-GLUC-BER_01"
      ],
      "primary_study_id": "MET-GLUC-BER_01",
      "url": "https://doi.org/10.1234/berberine-met-gluc-ber-01"
    },
    {
      "type": "doi",
      "identifier": "10.1234/berberine-met-gluc-ber-02",
      "study_ids": [
        "MET-GLUC-BER_02"
      ],
      "primary_study_id": "MET-GLUC-BER_02",
      "url": "https://doi.org/10.1234/berberine-met-gluc-ber-02"
    },
    {
      "type": "doi",
      "identifier": "10.1234/berberine-met-gluc-ber-03",
      "study_ids": [
        "MET-GLUC-BER_03"
      ],
      "primary_study_id": "MET-GLUC-BER_03",
      "url": "https://doi.org/10.1234/berberine-met-gluc-ber-03"
    }
  ],
  "manifest_hash": "sha256:30139160ca2484456bd2fefa066917e20dcf1c395e6698b36fa15e7cf6ee6951"
}
