{
  "generated": "2025-10-24T08:19:09.666325+00:00",
  "policy_fingerprint": "0xbe3a798944b1c64b",
  "source_evidence": "entries/immune/vitamin-c-imm-imm03/immune/v1/evidence.csv",
  "preferred_citation": "Kim G. TERVYX Protocol v1.0 (2025).",
  "studies": [
    {
      "study_id": "IMM-IMM03_01",
      "year": 2015,
      "design": "randomized controlled trial",
      "journal": "immune_journal",
      "outcome": "antiviral_support",
      "population": "Adults with antiviral support concerns",
      "adverse_events": "None reported",
      "doi": "10.1234/vitamin-c-imm-imm03-01",
      "url": "https://doi.org/10.1234/vitamin-c-imm-imm03-01",
      "citation": "IMM-IMM03_01 (2015); Journal: immune_journal; Design: randomized controlled trial; Population: Adults with antiviral support concerns; Outcome: antiviral_support; DOI: 10.1234/vitamin-c-imm-imm03-01; Adverse Events: None reported."
    },
    {
      "study_id": "IMM-IMM03_02",
      "year": 2016,
      "design": "randomized controlled trial",
      "journal": "immune_journal",
      "outcome": "antiviral_support",
      "population": "Adults with antiviral support concerns",
      "adverse_events": "None reported",
      "doi": "10.1234/vitamin-c-imm-imm03-02",
      "url": "https://doi.org/10.1234/vitamin-c-imm-imm03-02",
      "citation": "IMM-IMM03_02 (2016); Journal: immune_journal; Design: randomized controlled trial; Population: Adults with antiviral support concerns; Outcome: antiviral_support; DOI: 10.1234/vitamin-c-imm-imm03-02; Adverse Events: None reported."
    },
    {
      "study_id": "IMM-IMM03_03",
      "year": 2017,
      "design": "randomized controlled trial",
      "journal": "immune_journal",
      "outcome": "antiviral_support",
      "population": "Adults with antiviral support concerns",
      "adverse_events": "None reported",
      "doi": "10.1234/vitamin-c-imm-imm03-03",
      "url": "https://doi.org/10.1234/vitamin-c-imm-imm03-03",
      "citation": "IMM-IMM03_03 (2017); Journal: immune_journal; Design: randomized controlled trial; Population: Adults with antiviral support concerns; Outcome: antiviral_support; DOI: 10.1234/vitamin-c-imm-imm03-03; Adverse Events: None reported."
    }
  ],
  "references": [
    {
      "type": "doi",
      "identifier": "10.1234/vitamin-c-imm-imm03-01",
      "study_ids": [
        "IMM-IMM03_01"
      ],
      "primary_study_id": "IMM-IMM03_01",
      "url": "https://doi.org/10.1234/vitamin-c-imm-imm03-01"
    },
    {
      "type": "doi",
      "identifier": "10.1234/vitamin-c-imm-imm03-02",
      "study_ids": [
        "IMM-IMM03_02"
      ],
      "primary_study_id": "IMM-IMM03_02",
      "url": "https://doi.org/10.1234/vitamin-c-imm-imm03-02"
    },
    {
      "type": "doi",
      "identifier": "10.1234/vitamin-c-imm-imm03-03",
      "study_ids": [
        "IMM-IMM03_03"
      ],
      "primary_study_id": "IMM-IMM03_03",
      "url": "https://doi.org/10.1234/vitamin-c-imm-imm03-03"
    }
  ],
  "manifest_hash": "sha256:b615d6bc51f7924f65686f9d93adae776f886e7e47d9b1108644f5621f0b2d2f"
}
