{
  "generated": "2025-11-06T07:07:41.511320+00:00",
  "policy_fingerprint": "0x6036438e1b958d88",
  "source_evidence": "entries/metabolic/cinnamon-meta-gen-0444/metabolic/v1/evidence.csv",
  "preferred_citation": "Kim G. TERVYX Protocol v1.0 (2025).",
  "studies": [
    {
      "study_id": "META-GEN-0444_01",
      "year": 2015,
      "design": "randomized controlled trial",
      "journal": "metabolic_journal",
      "outcome": "weight_management",
      "population": "Adults with weight management concerns",
      "adverse_events": "Transient headache",
      "doi": "10.1234/cinnamon-meta-gen-0444-01",
      "url": "https://doi.org/10.1234/cinnamon-meta-gen-0444-01",
      "citation": "META-GEN-0444_01 (2015); Journal: metabolic_journal; Design: randomized controlled trial; Population: Adults with weight management concerns; Outcome: weight_management; DOI: 10.1234/cinnamon-meta-gen-0444-01; Adverse Events: Transient headache."
    },
    {
      "study_id": "META-GEN-0444_02",
      "year": 2016,
      "design": "randomized controlled trial",
      "journal": "metabolic_journal",
      "outcome": "weight_management",
      "population": "Adults with weight management concerns",
      "adverse_events": "None reported",
      "doi": "10.1234/cinnamon-meta-gen-0444-02",
      "url": "https://doi.org/10.1234/cinnamon-meta-gen-0444-02",
      "citation": "META-GEN-0444_02 (2016); Journal: metabolic_journal; Design: randomized controlled trial; Population: Adults with weight management concerns; Outcome: weight_management; DOI: 10.1234/cinnamon-meta-gen-0444-02; Adverse Events: None reported."
    },
    {
      "study_id": "META-GEN-0444_03",
      "year": 2017,
      "design": "randomized controlled trial",
      "journal": "metabolic_journal",
      "outcome": "weight_management",
      "population": "Adults with weight management concerns",
      "adverse_events": "Transient headache",
      "doi": "10.1234/cinnamon-meta-gen-0444-03",
      "url": "https://doi.org/10.1234/cinnamon-meta-gen-0444-03",
      "citation": "META-GEN-0444_03 (2017); Journal: metabolic_journal; Design: randomized controlled trial; Population: Adults with weight management concerns; Outcome: weight_management; DOI: 10.1234/cinnamon-meta-gen-0444-03; Adverse Events: Transient headache."
    }
  ],
  "references": [
    {
      "type": "doi",
      "identifier": "10.1234/cinnamon-meta-gen-0444-01",
      "study_ids": [
        "META-GEN-0444_01"
      ],
      "primary_study_id": "META-GEN-0444_01",
      "url": "https://doi.org/10.1234/cinnamon-meta-gen-0444-01"
    },
    {
      "type": "doi",
      "identifier": "10.1234/cinnamon-meta-gen-0444-02",
      "study_ids": [
        "META-GEN-0444_02"
      ],
      "primary_study_id": "META-GEN-0444_02",
      "url": "https://doi.org/10.1234/cinnamon-meta-gen-0444-02"
    },
    {
      "type": "doi",
      "identifier": "10.1234/cinnamon-meta-gen-0444-03",
      "study_ids": [
        "META-GEN-0444_03"
      ],
      "primary_study_id": "META-GEN-0444_03",
      "url": "https://doi.org/10.1234/cinnamon-meta-gen-0444-03"
    }
  ],
  "manifest_hash": "sha256:030f3aca39af8024a16ab9305ecb8700f33eecb449e38646cbc1d46f96b6ac49"
}
