{
  "generated": "2025-11-06T07:17:07.831492+00:00",
  "policy_fingerprint": "0x6036438e1b958d88",
  "source_evidence": "entries/physiological/boron-musc-gen-0729/musculoskeletal/v1/evidence.csv",
  "preferred_citation": "Kim G. TERVYX Protocol v1.0 (2025).",
  "studies": [
    {
      "study_id": "MUSC-GEN-0729_01",
      "year": 2016,
      "design": "randomized controlled trial",
      "journal": "musculoskeletal_journal",
      "outcome": "sarcopenia",
      "population": "Adults with sarcopenia concerns",
      "adverse_events": "None reported",
      "doi": "10.1234/boron-musc-gen-0729-01",
      "url": "https://doi.org/10.1234/boron-musc-gen-0729-01",
      "citation": "MUSC-GEN-0729_01 (2016); Journal: musculoskeletal_journal; Design: randomized controlled trial; Population: Adults with sarcopenia concerns; Outcome: sarcopenia; DOI: 10.1234/boron-musc-gen-0729-01; Adverse Events: None reported."
    },
    {
      "study_id": "MUSC-GEN-0729_02",
      "year": 2017,
      "design": "randomized controlled trial",
      "journal": "musculoskeletal_journal",
      "outcome": "sarcopenia",
      "population": "Adults with sarcopenia concerns",
      "adverse_events": "Mild GI discomfort",
      "doi": "10.1234/boron-musc-gen-0729-02",
      "url": "https://doi.org/10.1234/boron-musc-gen-0729-02",
      "citation": "MUSC-GEN-0729_02 (2017); Journal: musculoskeletal_journal; Design: randomized controlled trial; Population: Adults with sarcopenia concerns; Outcome: sarcopenia; DOI: 10.1234/boron-musc-gen-0729-02; Adverse Events: Mild GI discomfort."
    },
    {
      "study_id": "MUSC-GEN-0729_03",
      "year": 2018,
      "design": "randomized controlled trial",
      "journal": "musculoskeletal_journal",
      "outcome": "sarcopenia",
      "population": "Adults with sarcopenia concerns",
      "adverse_events": "Mild GI discomfort",
      "doi": "10.1234/boron-musc-gen-0729-03",
      "url": "https://doi.org/10.1234/boron-musc-gen-0729-03",
      "citation": "MUSC-GEN-0729_03 (2018); Journal: musculoskeletal_journal; Design: randomized controlled trial; Population: Adults with sarcopenia concerns; Outcome: sarcopenia; DOI: 10.1234/boron-musc-gen-0729-03; Adverse Events: Mild GI discomfort."
    }
  ],
  "references": [
    {
      "type": "doi",
      "identifier": "10.1234/boron-musc-gen-0729-01",
      "study_ids": [
        "MUSC-GEN-0729_01"
      ],
      "primary_study_id": "MUSC-GEN-0729_01",
      "url": "https://doi.org/10.1234/boron-musc-gen-0729-01"
    },
    {
      "type": "doi",
      "identifier": "10.1234/boron-musc-gen-0729-02",
      "study_ids": [
        "MUSC-GEN-0729_02"
      ],
      "primary_study_id": "MUSC-GEN-0729_02",
      "url": "https://doi.org/10.1234/boron-musc-gen-0729-02"
    },
    {
      "type": "doi",
      "identifier": "10.1234/boron-musc-gen-0729-03",
      "study_ids": [
        "MUSC-GEN-0729_03"
      ],
      "primary_study_id": "MUSC-GEN-0729_03",
      "url": "https://doi.org/10.1234/boron-musc-gen-0729-03"
    }
  ],
  "manifest_hash": "sha256:7dd1df1d9dc276f4457c6581133ea474ce102e33ec0a5b509fc177fea3a6f2a9"
}
