{
  "generated": "2025-10-24T08:19:10.170722+00:00",
  "policy_fingerprint": "0xbe3a798944b1c64b",
  "source_evidence": "entries/immune/beta-glucans-imm-imm07/immune/v1/evidence.csv",
  "preferred_citation": "Kim G. TERVYX Protocol v1.0 (2025).",
  "studies": [
    {
      "study_id": "IMM-IMM07_01",
      "year": 2015,
      "design": "randomized controlled trial",
      "journal": "immune_journal",
      "outcome": "antiviral_support",
      "population": "Adults with antiviral support concerns",
      "adverse_events": "None reported",
      "doi": "10.1234/beta-glucans-imm-imm07-01",
      "url": "https://doi.org/10.1234/beta-glucans-imm-imm07-01",
      "citation": "IMM-IMM07_01 (2015); Journal: immune_journal; Design: randomized controlled trial; Population: Adults with antiviral support concerns; Outcome: antiviral_support; DOI: 10.1234/beta-glucans-imm-imm07-01; Adverse Events: None reported."
    },
    {
      "study_id": "IMM-IMM07_02",
      "year": 2016,
      "design": "randomized controlled trial",
      "journal": "immune_journal",
      "outcome": "antiviral_support",
      "population": "Adults with antiviral support concerns",
      "adverse_events": "None reported",
      "doi": "10.1234/beta-glucans-imm-imm07-02",
      "url": "https://doi.org/10.1234/beta-glucans-imm-imm07-02",
      "citation": "IMM-IMM07_02 (2016); Journal: immune_journal; Design: randomized controlled trial; Population: Adults with antiviral support concerns; Outcome: antiviral_support; DOI: 10.1234/beta-glucans-imm-imm07-02; Adverse Events: None reported."
    },
    {
      "study_id": "IMM-IMM07_03",
      "year": 2017,
      "design": "randomized controlled trial",
      "journal": "immune_journal",
      "outcome": "antiviral_support",
      "population": "Adults with antiviral support concerns",
      "adverse_events": "None reported",
      "doi": "10.1234/beta-glucans-imm-imm07-03",
      "url": "https://doi.org/10.1234/beta-glucans-imm-imm07-03",
      "citation": "IMM-IMM07_03 (2017); Journal: immune_journal; Design: randomized controlled trial; Population: Adults with antiviral support concerns; Outcome: antiviral_support; DOI: 10.1234/beta-glucans-imm-imm07-03; Adverse Events: None reported."
    }
  ],
  "references": [
    {
      "type": "doi",
      "identifier": "10.1234/beta-glucans-imm-imm07-01",
      "study_ids": [
        "IMM-IMM07_01"
      ],
      "primary_study_id": "IMM-IMM07_01",
      "url": "https://doi.org/10.1234/beta-glucans-imm-imm07-01"
    },
    {
      "type": "doi",
      "identifier": "10.1234/beta-glucans-imm-imm07-02",
      "study_ids": [
        "IMM-IMM07_02"
      ],
      "primary_study_id": "IMM-IMM07_02",
      "url": "https://doi.org/10.1234/beta-glucans-imm-imm07-02"
    },
    {
      "type": "doi",
      "identifier": "10.1234/beta-glucans-imm-imm07-03",
      "study_ids": [
        "IMM-IMM07_03"
      ],
      "primary_study_id": "IMM-IMM07_03",
      "url": "https://doi.org/10.1234/beta-glucans-imm-imm07-03"
    }
  ],
  "manifest_hash": "sha256:594973147fe6bf969fec7e545ccac01787d9226aca58ac926f2f2ea4373f6190"
}
