{
  "generated": "2025-11-06T07:07:45.531781+00:00",
  "policy_fingerprint": "0x6036438e1b958d88",
  "source_evidence": "entries/psychological/sulforaphane-ment-gen-0297/mental_health/v1/evidence.csv",
  "preferred_citation": "Kim G. TERVYX Protocol v1.0 (2025).",
  "studies": [
    {
      "study_id": "MENT-GEN-0297_01",
      "year": 2013,
      "design": "randomized controlled trial",
      "journal": "mental_health_journal",
      "outcome": "depression",
      "population": "Adults with depression concerns",
      "adverse_events": "Transient headache",
      "doi": "10.1234/sulforaphane-ment-gen-0297-01",
      "url": "https://doi.org/10.1234/sulforaphane-ment-gen-0297-01",
      "citation": "MENT-GEN-0297_01 (2013); Journal: mental_health_journal; Design: randomized controlled trial; Population: Adults with depression concerns; Outcome: depression; DOI: 10.1234/sulforaphane-ment-gen-0297-01; Adverse Events: Transient headache."
    },
    {
      "study_id": "MENT-GEN-0297_02",
      "year": 2014,
      "design": "randomized controlled trial",
      "journal": "mental_health_journal",
      "outcome": "depression",
      "population": "Adults with depression concerns",
      "adverse_events": "Transient headache",
      "doi": "10.1234/sulforaphane-ment-gen-0297-02",
      "url": "https://doi.org/10.1234/sulforaphane-ment-gen-0297-02",
      "citation": "MENT-GEN-0297_02 (2014); Journal: mental_health_journal; Design: randomized controlled trial; Population: Adults with depression concerns; Outcome: depression; DOI: 10.1234/sulforaphane-ment-gen-0297-02; Adverse Events: Transient headache."
    },
    {
      "study_id": "MENT-GEN-0297_03",
      "year": 2015,
      "design": "randomized controlled trial",
      "journal": "mental_health_journal",
      "outcome": "depression",
      "population": "Adults with depression concerns",
      "adverse_events": "Transient headache",
      "doi": "10.1234/sulforaphane-ment-gen-0297-03",
      "url": "https://doi.org/10.1234/sulforaphane-ment-gen-0297-03",
      "citation": "MENT-GEN-0297_03 (2015); Journal: mental_health_journal; Design: randomized controlled trial; Population: Adults with depression concerns; Outcome: depression; DOI: 10.1234/sulforaphane-ment-gen-0297-03; Adverse Events: Transient headache."
    }
  ],
  "references": [
    {
      "type": "doi",
      "identifier": "10.1234/sulforaphane-ment-gen-0297-01",
      "study_ids": [
        "MENT-GEN-0297_01"
      ],
      "primary_study_id": "MENT-GEN-0297_01",
      "url": "https://doi.org/10.1234/sulforaphane-ment-gen-0297-01"
    },
    {
      "type": "doi",
      "identifier": "10.1234/sulforaphane-ment-gen-0297-02",
      "study_ids": [
        "MENT-GEN-0297_02"
      ],
      "primary_study_id": "MENT-GEN-0297_02",
      "url": "https://doi.org/10.1234/sulforaphane-ment-gen-0297-02"
    },
    {
      "type": "doi",
      "identifier": "10.1234/sulforaphane-ment-gen-0297-03",
      "study_ids": [
        "MENT-GEN-0297_03"
      ],
      "primary_study_id": "MENT-GEN-0297_03",
      "url": "https://doi.org/10.1234/sulforaphane-ment-gen-0297-03"
    }
  ],
  "manifest_hash": "sha256:7bc45d92bb34acbbe318ec1d987a86627689eb9b53e319c3240e1a45a67997da"
}
