{
  "generated": "2025-11-06T07:07:40.414010+00:00",
  "policy_fingerprint": "0x6036438e1b958d88",
  "source_evidence": "entries/physiological/vitamin-k2-card-gen-0330/cardiovascular/v1/evidence.csv",
  "preferred_citation": "Kim G. TERVYX Protocol v1.0 (2025).",
  "studies": [
    {
      "study_id": "CARD-GEN-0330_01",
      "year": 2012,
      "design": "randomized controlled trial",
      "journal": "cardiovascular_journal",
      "outcome": "circulation",
      "population": "Adults with circulation concerns",
      "adverse_events": "Transient headache",
      "doi": "10.1234/vitamin-k2-card-gen-0330-01",
      "url": "https://doi.org/10.1234/vitamin-k2-card-gen-0330-01",
      "citation": "CARD-GEN-0330_01 (2012); Journal: cardiovascular_journal; Design: randomized controlled trial; Population: Adults with circulation concerns; Outcome: circulation; DOI: 10.1234/vitamin-k2-card-gen-0330-01; Adverse Events: Transient headache."
    },
    {
      "study_id": "CARD-GEN-0330_02",
      "year": 2013,
      "design": "randomized controlled trial",
      "journal": "cardiovascular_journal",
      "outcome": "circulation",
      "population": "Adults with circulation concerns",
      "adverse_events": "Transient headache",
      "doi": "10.1234/vitamin-k2-card-gen-0330-02",
      "url": "https://doi.org/10.1234/vitamin-k2-card-gen-0330-02",
      "citation": "CARD-GEN-0330_02 (2013); Journal: cardiovascular_journal; Design: randomized controlled trial; Population: Adults with circulation concerns; Outcome: circulation; DOI: 10.1234/vitamin-k2-card-gen-0330-02; Adverse Events: Transient headache."
    },
    {
      "study_id": "CARD-GEN-0330_03",
      "year": 2014,
      "design": "randomized controlled trial",
      "journal": "cardiovascular_journal",
      "outcome": "circulation",
      "population": "Adults with circulation concerns",
      "adverse_events": "Mild GI discomfort",
      "doi": "10.1234/vitamin-k2-card-gen-0330-03",
      "url": "https://doi.org/10.1234/vitamin-k2-card-gen-0330-03",
      "citation": "CARD-GEN-0330_03 (2014); Journal: cardiovascular_journal; Design: randomized controlled trial; Population: Adults with circulation concerns; Outcome: circulation; DOI: 10.1234/vitamin-k2-card-gen-0330-03; Adverse Events: Mild GI discomfort."
    }
  ],
  "references": [
    {
      "type": "doi",
      "identifier": "10.1234/vitamin-k2-card-gen-0330-01",
      "study_ids": [
        "CARD-GEN-0330_01"
      ],
      "primary_study_id": "CARD-GEN-0330_01",
      "url": "https://doi.org/10.1234/vitamin-k2-card-gen-0330-01"
    },
    {
      "type": "doi",
      "identifier": "10.1234/vitamin-k2-card-gen-0330-02",
      "study_ids": [
        "CARD-GEN-0330_02"
      ],
      "primary_study_id": "CARD-GEN-0330_02",
      "url": "https://doi.org/10.1234/vitamin-k2-card-gen-0330-02"
    },
    {
      "type": "doi",
      "identifier": "10.1234/vitamin-k2-card-gen-0330-03",
      "study_ids": [
        "CARD-GEN-0330_03"
      ],
      "primary_study_id": "CARD-GEN-0330_03",
      "url": "https://doi.org/10.1234/vitamin-k2-card-gen-0330-03"
    }
  ],
  "manifest_hash": "sha256:650e155245f7384228b437146c450f631c73eb15266b3ba347dd235e31297fe0"
}
